{
  "$schema": "http://json-schema.org/draft-07/schema",
  "type": "object",
  "additionalProperties": false,
  "default": {},
  "title": "Root Schema",
  "required": [
    "lang",
    "createDate",
    "updateDate",
    "name",
    "valence",
    "description",
    "models"
  ],
  "properties": {
    "lang": {
      "type": "string",
      "examples": [
        "en/us"
      ]
    },
    "createDate": {
      "type": "string",
      "examples": [
        "20250217"
      ]
    },
    "updateDate": {
      "type": "string",
      "examples": [
        "20250217"
      ]
    },
    "name": {
      "type": "string"
    },
    "alternateNames": {
      "type": "array",
      "default": [],
      "items": {
        "type": "string"
      }
    },
    "tags": {
      "type": "array",
      "default": [],
      "items": {
        "type": "string"
      }
    },
    "valence": {
      "type": "integer",
      "default": 0,
      "examples": [
        1
      ]
    },
    "timescale": {
      "type": "array",
      "default": ["unknown"],
      "items": {
        "type": "string",
        "enum": ["unknown","under","seconds","minutes","hours","days","weeks","months","years","lifetime","up"]
      }
    },
    "rarity": {
      "type": "array",
      "default": ["unknown"],
      "items": {
        "type": "string",
        "enum": ["unknown","few","half","most","everyone"]
      }
    },
    "frequency": {
      "type": "array",
      "default": ["unknown"],
      "items": {
        "type": "string",
        "enum": ["unknown","less","a few times per life","yearly","monthly","weekly","daily","hourly","more","constant"]
      }
    },
    "quote": {
      "type": "string"
    },
    "description": {
      "type": "string"
    },
    "alternateDefinitions": {
      "type": "array",
      "default": [],
      "items": {
        "type": "string"
      }
    },
    "perceptions": {
      "type": "array",
      "default": [],
      "items": {
        "type": "string"
      }
    },
    "desires": {
      "type": "array",
      "default": [],
      "items": {
        "type": "string"
      }
    },
    "sensations": {
      "type": "array",
      "default": [],
      "items": {
        "type": "string"
      }
    },
    "results": {
      "type": "array",
      "default": [],
      "items": {
        "type": "string"
      }
    },
    "personOfInterestExperiences": {
      "type": "array",
      "default": [],
      "items": {
        "type": "string"
      }
    },
    "otherVariations": {
      "type": "array",
      "default": [],
      "items": {
        "type": "string"
      }
    },
    "related": {
      "type": "array",
      "default": [],
      "items": {
        "type": "string"
      }
    },
    "opposites": {
      "type": "array",
      "default": [],
      "items": {
        "type": "string"
      }
    },
    "examples": {
      "type": "array",
      "default": [],
      "items": {
        "type": "string"
      }
    },
    "guidance": {
      "type": "array",
      "default": [],
      "items": {
        "type": "object",
        "additionalProperties": false,
        "default": {},
        "required": [ "references" ],
        "properties": {
          "description": {
            "type": "string"
          },
          "attribution": {
            "type": "string"
          },
          "references": {
              "type": "array",
              "default": [],
              "items": {
                "type": "string"
              }
          }
        }
      }
    },
    "variations": {
      "type": "array",
      "default": [],
      "items": {
        "type": "object",
        "additionalProperties": false,
        "default": {},
        "required": [
          "name",
          "description"
        ],
        "properties": {
          "name": {
            "type": "string"
          },
          "alternateNames": {
            "type": "array",
            "default": [],
            "items": {
              "type": "string"
            }
          },
          "alternateDefinitions": {
            "type": "array",
            "default": [],
            "items": {
              "type": "string"
            }
          },
          "tags": {
            "type": "array",
            "default": [],
            "items": {
              "type": "string"
            }
          },
          "description": {
            "type": "string"
          },
          "timescale": {
            "type": "array",
            "default": ["unknown"],
            "items": {
              "type": "string",
              "enum": ["unknown","under","seconds","minutes","hours","days","weeks","months","years","lifetime","up"]
            }
          },
          "rarity": {
            "type": "array",
            "default": ["unknown"],
            "items": {
              "type": "string",
              "enum": ["unknown","few","half","most","everyone"]
            }
          },
          "frequency": {
            "type": "array",
            "default": ["unknown"],
            "items": {
              "type": "string",
              "enum": ["unknown","less","a few times per life","yearly","monthly","weekly","daily","hourly","more","constant"]
            }
          },
	  "perceptions": {
	      "type": "array",
	      "default": [],
	      "items": {
		"type": "string"
	      }
	  },
	  "desires": {
	      "type": "array",
	      "default": [],
	      "items": {
		"type": "string"
	      }
	  },
	  "sensations": {
	      "type": "array",
	      "default": [],
	      "items": {
		"type": "string"
	     }
	  },
	  "results": {
	      "type": "array",
	      "default": [],
	      "items": {
		"type": "string"
	      }
	    },
	  "personOfInterestExperiences": {
	      "type": "array",
	      "default": [],
	      "items": {
		"type": "string"
	      }
	    },
          "related": {
            "type": "array",
            "default": [],
            "items": {
              "type": "string"
            }
          },
          "examples": {
            "type": "array",
            "default": [],
            "items": {
              "type": "string"
            }
          },
          "opposites": {
            "type": "array",
            "default": [],
            "items": {
              "type": "string"
            }
          },
	    "guidance": {
	      "type": "array",
	      "default": [],
	      "items": {
		"type": "object",
		"additionalProperties": false,
		"default": {},
		"required": [ "references" ],
		"properties": {
		  "description": {
		    "type": "string"
		  },
		  "attribution": {
		    "type": "string"
		  },
		  "references": {
		      "type": "array",
		      "default": [],
		      "items": {
			"type": "string"
		      }
		  }
		}
	      }
	    },
	    "comparisons": {
	      "type": "array",
	      "default": [],
	      "items": {
		"type": "object",
		"additionalProperties": false,
		"default": {},
		"required": [
		  "links",
		  "description"
		],
		"properties": {
		  "links": {
		    "type": "array",
		    "default": [],
		    "items": {
		      "type": "string"
		    }
		  },
		  "description": {
		    "type": "string"
		  }
		}
	      }
	    },
            "commentaries": {
              "type": "array",
              "default": [],
              "items": {
                "type": "object",
                "additionalProperties": false,
                "default": {},
                "required": [
                  "quote"
                ],
                "properties": {
                  "quote": {
                    "type": "string"
                  },
                  "attribution": {
                    "type": "string"
                  },
                  "tags": {
                    "type": "array",
                    "default": [],
                    "items": {
                      "type": "string"
                    }
                  }
                }
              }
            }
        }
      }
    },
    "comparisons": {
      "type": "array",
      "default": [],
      "items": {
        "type": "object",
        "additionalProperties": false,
        "default": {},
        "required": [
          "links",
          "description"
        ],
        "properties": {
          "links": {
            "type": "array",
            "default": [],
            "items": {
              "type": "string"
            }
          },
          "description": {
            "type": "string"
          }
        }
      }
    },
    "commentaries": {
      "type": "array",
      "default": [],
      "items": {
        "type": "object",
        "additionalProperties": false,
        "default": {},
        "required": [
          "quote"
        ],
        "properties": {
          "quote": {
            "type": "string"
          },
          "attribution": {
            "type": "string"
          },
          "tags": {
            "type": "array",
            "default": [],
            "items": {
              "type": "string"
            }
          }
        }
      }
    },
    "spectrum": {
      "type": "object",
      "required": [],
      "properties": {}
    },
    "models": {
      "type": "array",
      "default": [],
      "items": {
        "type": "object",
        "additionalProperties": false,
        "default": {},
        "required": [
          "version",
          "variations"
        ],
        "properties": {
          "version": {
            "type": "string"
          },
          "variations": {
            "type": "array",
            "default": [],
            "items": {
              "type": "object",
              "additionalProperties": false,
              "default": {},
              "required": [
                "names",
                "levels"
              ],
              "properties": {
                "names": {
	          "type": "array",
	          "default": [],
	          "items": {
		    "type": "string"
	          }
                },
                "predominantType": {
                  "type": "string"
                },
		"levels": {
		    "type": "object",
		    "default": {},
		    "patternProperties": {
		      "^[0-9]+": {
			"type": "object",
                        "additionalProperties": false,
			"default": {},
			"properties": {
			  "experiences": {
			    "type": "array",
			    "default": [],
			    "items": {
			      "type": "string"
			    }
			  },
                          "description": {
                            "type": "string"
                          }
			}
		      }
		    }
		  }
                }
              }
            }
          }
        }
      }
    }
  }
